Date,Death,Injuries,Location,description
9/3/09,0,1,"San Bruno, California","A 20-year-old student was wounded in the parking lot of Skyline College after an argument between him and other men. The college campus was placed on lockdown. Three San Francisco residents, 18-year-old Germaine B. Benjamin, 20-year-old Dimaryea J. McGhee, and 18-year-old Jacori W. Bender, were each arrested and charged with felony firearm offenses.[391]"
10/16/09,1,0,"Conway, South Carolina","16-year-old student, Trevor Varinecz was killed by a school resource officer after allegedly stabbing the officer.[219][392]"
2/5/10,1,0,"Madison, Alabama","14-year-old student, Hammad Memon, killed 14-year-old Todd Brown at Discovery Middle School as classes were changing. The shooting was possibly related to gang activity. In May 2013, Memon pleaded guilty to the murder and was sentenced to thirty years of prison. After Memon is released from prison, he is likely to be deported to his native Pakistan.[393]"
2/12/10,3,3,"Huntsville, Alabama","University of Alabama in Huntsville shooting: 44-year-old biology professor, Amy Bishop, killed the chairman of the biology department, 52-year-old Gopi K. Podila, and biology professors, 50-year-old, Maria Ragland Davis and 52-year-old Adriel D. Johnson. She also wounded biology professors, Luis Rogelio Cruz-Vera and Joseph G. Leahy, and staff assistant, Stephanie Monticciolo.[392]"
2/19/10,0,1,"DeKalb, Illinois","Less than a week after Northern Illinois University solemnly marked the second anniversary of a mass shooting on campus that claimed the lives of five students, the DeKalb school was the scene of further gun violence. 24-year-old NIU student, Brian Mulder, refused entry to 22-year-old Zachary R. Isaacman, when he had tried to follow a female resident into the Stevenson Residence Hall North, where they were living, because he was not a resident. Moments later, while outside the dorm smoking with a friend, Mulder was shot by Isaacman, with a handgun in the leg above the knee. Isaacman tried to flee, but was caught by police within minutes.[394]"
2/23/10,0,2,"Littleton, Colorado","At Deer Creek Middle School, 32-year-old Bruco Strong Eagle Eastwood opened fire from a rifle in a parking lot, and wounded two eighth-graders Reagan Webber and Matt Thieu, before being restrained by 57-year-old Math teacher, David Benke, and held until his arrest. The boy's wounds were critical for the four days following the shooting.[395] In October 2011, Eastwood was found not guilty by reason of insanity.[396][392]"
3/9/10,1,1,"Columbus, Ohio","51-year-old Ohio State University custodian, Nathaniel Brown, killed a co-worker and wounded another.[392]"
9/8/10,0,2,"Detroit, Michigan","Two students were wounded in front of Mumford High School by 17-year-old Steven Jamal Hare. He was tried as an adult and charged with assault with intent to kill. In 2012, Hare was sentenced to 27 years in prison.[397]"
9/28/10,1,1,"Austin, Texas","A 19-year-old sophomore student Colton Tooley, wielding an AK-47 and wearing a ski mask, opened fire and then killed himself in a University of Texas library[398]"
10/1/10,1,0,"Salinas, California",15-year-old student Jose Daniel Cisneros was killed after being shot several times on an athletic field at Alisal High School while walking to school. Police said that the shooting was gang-related.[399]
10/8/10,0,2,"Carlsbad, California","41-year-old Brendan O'Rourke climbed over a fence and opened fire with a handgun in a playground of Kelly Elementary School, which had 230 students; two second-grade female students were grazed in the arms before O'Rourke was subdued by a construction worker. He was found guilty of seven counts of attempted murder and was sentenced to 189 years to life in prison.[400]"
11/29/10,1,0,"Marinette, Wisconsin","15-year-old Samuel Hengel, took 23 students and a teacher hostage inside a classroom of Marinette High School for five hours. He had stormed into the class, firing with a handgun at a movie projector. Police persuaded Hengel to release the hostages. After officers entered the building, Hengel shot himself in the head. He died the next day.[401]"
12/6/10,0,1,"Aurora, Colorado","In a gang-related attack outside Aurora Central High School, a 17-year-old girl was paralysed. She was one of a group of students outside the school. 20-year-old Luis Enrique Guzman-Rincon, had fired shots from a car trying to hit gang rivals. Guzman-Ricon was sentenced to thirty-five years in prison.[402]"
1/5/11,2,2,"Omaha, Nebraska","At Millard South High School, 18-year-old student, Robert Butler Jr., killed assistant principal Dr. Vicki Kaspar and wounded principal Curtis Case before opening fire at police in the front office area, causing the school nurse to be wounded by gunshot debris. Butler then drove to a parking lot and shot himself as police cornered him.[403]"
3/25/11,0,1,"Martinsville, Indiana","Michael Phelps, a 15-year-old suspended student, returned to Martinsville West Middle School with a handgun. In the entrance of the school, Phelps shot 15-year-old Chance Jackson twice in the abdomen, critically wounding him. Phelps fled the school and dropped the handgun; he was arrested shortly after. Jackson had to undergo surgery three times to save his life; he suffers from post-traumatic stress disorder. Phelps was convicted of attempted murder in August 2011, and was sentenced to thirty years in prison and five years of probation.[404]"
3/31/11,1,5,"Houston, Texas","Multiple gunmen opened fire during a powder puff football game at Worthing High School. One man, an 18-year-old former student named Tremaine De Ante’ Paul, died. Five other people were injured.[405]"
5/23/11,0,1,"Pearl City, Hawaii","A 14-year-old male student is accused of firing a handgun on the campus of Highlands Intermediate School, wounding one student. The gunman was arrested on suspicion of attempted murder. Two other suspects were arrested in connection with the shooting.[406]"
10/24/11,0,1,"Fayetteville, North Carolina","Cape Fear High School shooting: 15-year-old Catilyn Abercrombie, was shot in the neck with a rifle by fellow student, 15-year-old Charles Underwood, at Cape Fear High School. She was hospitalized for two months in a serious condition. Underwood was arrested and charged with attempted murder. He was convicted of attempted first-degree murder and sentenced to fifteen years in prison.[407]"
12/8/11,2,0,"Blacksburg, Virginia","22-year-old, Ross Truett Ashley, part-time business student at Radford University, killed a police officer engaged in an unrelated traffic stop on the campus of Virginia Tech, he then committed suicide in a nearby parking lot.[408]"
12/9/11,0,2,"Edinburg, Texas","Two students were shot after school at Harwell Middle School in Edinburg, Texas while trying out for their school's basketball team. The shooting allegedly was done by an adult off campus, who was shooting at a target range.[409]"
1/10/12,0,1,"Houston, Texas","A student opened fire with a handgun at North Forest High School, wounding another student. The shooter said that he had been confronted by three students who had been bullying him and he shot in self-defense. He hit a 16-year-old bystander in the leg. The 18-year-old suspect was charged with aggravated assault with a deadly weapon.[410]"
2/27/12,3,3,"Chardon, Ohio","Chardon High School shooting: 17-year-old Thomas ""T. J."" Lane, took a semi-automatic handgun and a knife to Chardon High School, where he fired ten shots at a group of students sitting in the cafeteria. He killed three boys and wounded three other students. One 16-year-old died immediately, two others died the following day. Lane was arrested early the next morning while standing near his car.[411] He was charged as an adult with murder, attempted murder, and firearms offenses. In March 2013, he was convicted and sentenced to three life sentences without the possibility of parole.[412]"
3/6/12,2,0,"Jacksonville, Florida","A murder-suicide resulted in two deaths on the campus of the Episcopal School of Jacksonville. Shane Schumerth, a Spanish teacher who had been fired that morning returned to the campus in the early afternoon via a pedestrian entrance, armed with an AK-47 which he concealed in a guitar case. He entered the office of the Head of School, Dale Regan, and fired multiple shots, fatally wounding her. Schumerth then killed himself, in the office.[413]"
4/2/12,7,3,"Oakland, California","Oikos University shooting: 43-year-old One L. Goh, was accused of shooting dead seven students with a handgun and wounding three others at Oikos University, a Christian college. He fled the scene, stealing a victim's car, and was apprehended hours later nearby. Goh was charged with seven counts of murder. In January 2013, Goh was determined to be mentally unfit for trial and committed for treatment.[414]"
8/16/12,0,2,"Memphis, Tennessee",Two Hamilton High School students were wounded in the parking lot of the school. The attack was believed to be gang-related.[415]
8/27/12,0,1,"Perry Hall, Maryland","15-year-old Robert Gladden, fired two shots with a shotgun inside the cafeteria at Perry Hall School. He hit a 17-year-old senior in the lower back, causing critical wounds. The youth has Down syndrome. Gladden was subdued by two school faculty members, and arrested. In February 2013, he was sentenced to thirty-five years in prison on attempted murder charges.[416]"
9/7/12,0,0,"Normal, Illinois","A 14-year-old student fired multiple gunshots in a classroom ceiling at Normal Community High School, and was tackled by a teacher. Nobody was injured. The student was arrested and charged with sixteen felony counts.[417][418]"
9/26/12,1,0,"Stillwater, Oklahoma","A 13-year-old male at Stillwater Junior High School pulled out a gun and shot himself in the head at 7:50 AM on the day of a school-wide standardized test. No one else was injured, and the cause of the suicide is still unknown.[419]"
10/6/12,1,0,"Mobile, Alabama","A University of South Alabama student, Gil Collar, was fatally shot by a campus police officer while having a medical emergency. Collar, 18, had ingested a legal lab chemical. It is unknown if he had done so voluntarily. Acting erratically, he approached the police station while naked and battered. Officer Trevis Austin, equipped with pepper spray and a baton, felt his life was threatened by the unarmed 140 lb teen. Video shows that the officer shot Collar before the student approached within five feet of him.[420] Austin was cleared of any wrongdoing by the university.[421]"
10/19/12,1,0,"Chicago, Illinois","18-year-old Banner Academy South student, Terrance Wright, was killed during an attempted robbery. Wright was approached by five would-be robbers as he left the school about 3:40 p.m.. He was shot in the chest as he fought back when one assailant was going through his pockets. Wright had been picked on at his previous high school because he was gay, which led him to transfer to Banner.[422]"
10/31/12,0,4,"Los Angeles, California","At a Halloween party on the University of Southern California campus, an argument escalated and 20-year-old Brandon Spencer, used a handgun to shoot rival gang member, Geno Hall, seven times, critically wounding him. Spencer wounded three other people, none were students at USC, they were hospitalized with less serious injuries. Spencer was arrested just minutes after the shooting, which took place outside USC’s Grand Ballroom at around 11:30 p.m.[423] In April 2014, he was convicted of attempted murder and sentenced to forty years to life in prison.[424]"
12/14/12,28,2,"Newtown, Connecticut","Sandy Hook Elementary School shooting: 20-year-old Adam Lanza, killed twenty-six people and himself. He first killed his mother at their shared home before taking her guns and driving to the school. Lanza brought four guns with him. He killed twenty first-grade children aged six and seven during the attack at school, along with six adults, including four teachers, the principal, and the school psychologist. Two other persons were injured. Lanza then killed himself as police arrived at the school.[411][425]"
1/7/13,1,0,"Fort Myers, Florida","Shots were fired at Apostolic Revival Center Christian School, leaving 27-year-old Kristopher Smith dead in what was believed to be a retaliation killing, possibly for his talking with police about a previous incident.[426][427]"
1/10/13,0,2,"Taft, California","16-year-old student, Bryan Oliver, entered a science classroom of Taft Union High School with a shotgun and opened fire, critically wounding 16-year-old student Bowe Cleveland. He shot at but missed another student. The classroom teacher Ryan Heber convinced Oliver, to drop his weapon. He was later arrested. On January 14, he was charged with two counts of attempted murder and assault with a firearm.[428] He was convicted and accepted a plea deal with a sentence of 27 years and 4 months.[429] According to the attorney[430] for the Cleveland family, they were not satisfied with the sentence."
1/12/13,0,1,"Detroit, Michigan",A 16-year-old Osborn High School student is wounded after a basketball game.[428]
1/15/13,0,2,"St. Louis, Missouri","A 34-year-old gunman wounded an administrator in his office on the fourth floor of Stevens Institute of Business and Arts. The suspected gunman, Sean Johnson, a part-time student, wounded himself in a stairwell. Both the administrator and Johnson were hospitalized in stable conditions. Johnson was charged with three felony charges, including assault.[431][432]"
1/15/13,3,0,"Hazard, Kentucky","Two people were killed and a third person was wounded at the parking lot of Hazard Community and Technical College.[433] The third victim, 12-year-old Taylor Cornett, died from her wounds the next day.[434] 21-year-old Dalton Lee Stidham, was arrested and charged with three counts of murder."
1/16/13,1,0,"Chicago, Illinois","A 17-year-old boy, Tyrone Lawson, was killed in a parking lot of Chicago State University. The shooting happened after high school basketball games held on the campus, where Lawson had been a spectator. Police arrested two brothers, Michael McNabb, 33, and Brian Hewlett (under the alias Stephen Gilbert), 30 after the shooting and recovered a weapon.[428][435][436]"
1/22/13,0,3,"Houston, Texas","Lone Star College–North Harris shooting: Outside Lone Star College–North Harris, two men got into an argument. One wounded the other. He also wounded a maintenance man, and accidentally shot himself in the leg. The shooter fled into the woods and was arrested hours later. The charges against the initial suspect were dropped and another man was arrested.[437]"
1/31/13,0,0,"Phoenix, Arizona","An argument between two rival gangs escalated to what police described as a ""gun battle"" at Cesar Chavez High School. Approximately fifteen shots were fired in the vicinity of people waiting to get into a scheduled boys' basketball game. No one was injured.[438]"
1/31/13,0,2,"Atlanta, Georgia","A 14-year-old male student was wounded at Price Middle School. The gunman, a 15-year-old student, was believed to be arguing with the other student before using a handgun to shoot him. A teacher was also wounded. Afterward, the gunman was disarmed by a school resource officer and arrested; police charged him with aggravated assault.[439][440]"
3/18/13,1,0,"Orlando, Florida","At the University of Central Florida, 30-year-old student James Oliver Seevakumaran pulled a fire alarm at the Tower One dormitory, to attract a crowd. He pointed a handgun at his roommate and threatened to shoot him in their room; he released the roommate, who ran out and called 9-1-1. Seevakumaran then fatally shot himself in the head. Authorities found an assault weapon, a couple hundred rounds of ammunition and four homemade bombs inside his backpack.[441]"
4/12/13,0,2,"Christiansburg, Virginia","New River Community College shooting incident: Two women were wounded during a shooting at the campus of New River Community College. 18-year-old Neil Allen MacInnis, was taken into custody. In June 2014, he was sentenced to 38 years in prison.[442]"
4/16/13,0,3,"Grambling, Louisiana",Three students were injured on the campus of Grambling State University.[443]
4/18/13,1,0,"Cambridge, Massachusetts","Three days after committing the Boston Marathon bombings, while still at large, the brothers Dzhokhar Tsarnaev and Tamerlan Tsarnaev shot and killed Massachusetts Institute of Technology campus police officer Sean Collier[444] in his patrol car near MIT's Ray and Maria Stata Center.[445] About three hours after the MIT shooting and after carjacking a vehicle, Tamerlan died in a gunfight with police in Watertown, Massachusetts. Another officer was seriously wounded. Shot in the neck and hiding in a boat parked nearby, Dzhokhar was arrested 18 hours later, and hospitalized in critical condition.[445] He was sentenced to death in 2015."
5/14/13,0,0,"Birmingham, Alabama","Allegedly responding to a student fight, a mother of a student fired a weapon on the campus of Ossie Ware Mitchell Middle School. No one was injured.[446]"
6/7/13,6,4,"Santa Monica, California","2013 Santa Monica shooting: 23-year-old John Zawahri, began a killing spree at his home. After killing his 55-year-old father, Samir ""Sam"" Zawahri, and 25-year-old brother, Chris Zawahri, he set the house ablaze. Dressed all in black with body armor and wielding an AR-15-type semi-automatic rifle, Zawahri carjacked 41-year-old Laura Siska, shooting 50-year-old Debra Fine, as she attempted to intervene, before forcing Siska to drive to Santa Monica College. Upon arriving on the college campus, Zawahri began shooting at passing vehicles, including a police car and a city bus, leaving three people with minor injuries. Zawahri next targeted a Ford Explorer, killing the driver, 68-year-old campus groundskeeper, Carlos Navarro Franco, and fatally wounding the passenger, his 26-year-old daughter Marcela Diaz-Franco, a student at the college, who died two days later. 68-year-old Margarita Gomez, who was collecting cans outside the library, died after being shot in the abdomen and chest. Zawahri opened fire on students who were trying to run away. It ended at the college library where he opened fire on students studying for finals, before being fatally wounded in an exchange of gunfire with responding police officers.[447]"
8/20/13,0,0,"Decatur, Georgia","Armed with an AK-47 and other weapons,[448] 20-year-old Michael Brandon Hill fired six shots inside the front office of Ronald E. McNair Discovery Learning Academy. He barricaded himself in the office, where police returned fire. Nobody was injured. Children were evacuated. After talking with school bookkeeper, Antoinette Tuff in the front office, he was persuaded to surrender before anyone was hurt. Hill was arrested and charged.[449][450]"
8/23/13,1,2,"Sardis, Mississippi","15-year-old student, Roderick Bobo, was killed during a football game at North Panola High School in what was termed a gang-related shooting. Two others were injured in the shooting. Three men were charged as being responsible for the crime.[451]"
8/30/13,0,1,"Winston-Salem, North Carolina","A 15-year-old male student was shot at Carver High School, at 2:30 p.m.. He was hospitalized with minor injuries.[449] An 18-year-old male student was apprehended without further incident. The suspected gunman is charged with assault with a deadly weapon inflicting serious injury, carrying a concealed gun, possessing and discharging a firearm, and carrying a firearm onto educational property. The shooting was believed related to a dispute between the suspect and the victim.[452]"
10/4/13,0,2,"Pine Hills, Florida","A 16-year-old student was shot in the hip outside Agape Christian Academy after a fight broke out at 2 p.m.. An innocent bystander was hit by a stray bullet or shrapnel. The two victims were treated for minor injuries. The suspected shooter reportedly fled in a car with several other males, and was not caught.[453]"
10/21/13,2,2,"Sparks, Nevada","12-year-old seventh-grade student Jose Reyes opened fire with a handgun at the basketball courts of Sparks Middle School, injuring one student in the shoulder. Michael Landsberry, a teacher and veteran, tried to intervene and was killed by Reyes. Reyes also wounded a student trying to help the teacher. Reyes then committed suicide by shooting himself in the head.[411][449] The shooting happened before classes, and the school was evacuated and was closed for the week.[454]"
11/2/13,0,1,"Greensboro, North Carolina",A 21-year-old student was wounded at North Carolina A&T State University. The victim was hospitalized for serious but non-life-threatening injuries. The university was temporarily locked down that night. No suspects are in custody.[455]
11/3/13,0,2,"Lithonia, Georgia",A Stephenson High School student and a janitor were shot in an apparent confrontation between football team members and a group of teens who were not attending the school. Both were innocent bystanders.[456]
11/13/13,0,3,"Pittsburgh, Pennsylvania","After classes ended, at least one gunman came out of the woods and opened fire on three students as they were walking to their cars at Brashear High School. One student was grazed in the head, another was struck in the neck and shoulder, and a third was hit in the leg and foot. Six people were taken into custody. The shooting is believed to be drug-related.[457]"
12/4/13,0,1,"Winter Garden, Florida","A 15-year-old student was wounded by a 17-year-old student near a soccer field on the campus of West Orange High School. The shooting occurred after a fight broke out between the two students. The 17-year-old suspected shooter was taken into custody several miles away from the school, and is charged with attempted murder, aggravated battery with a firearm, possession of a firearm by a minor and possession of a firearm on school grounds. In October 2014, the shooter was sentenced to twenty-five years in prison.[458]"
12/13/13,2,0,"Centennial, Colorado","18-year-old Karl Pierson, shot 17-year-old student Claire Davis in the head, fatally injuring her, in a hallway in Arapahoe High School. Pierson then took his own life.[411] Pierson was armed with a shotgun, three Molotov cocktails, and a machete. His intention was to shoot the librarian who had disciplined him. Claire Davis died from her injuries on December 21, 2013.[459]"
12/19/13,0,1,"Fresno, California","Four teens (16, 16, 16 and 17 years old) entered Edison High School in what was believed as a gang-initiation process. After accosting a 62-year-old woman about a mile away from school grounds, they found an athletic trainer who taught at Edison High and shot him several times in the leg and stomach.[460]"
1/9/14,0,1,"Jackson, Tennessee",A 16-year-old student was charged with bringing a gun to school at Liberty Technology Magnet High School and shooting a classmate in the thigh. The incident occurred outside the front of the school.[461]
1/13/14,0,1,"New Haven, Connecticut","A 14-year-old boy was shot outside of a basketball game at the Hillhouse High School athletic facility, suffering wounds in his hand and leg.[cite]"
1/14/14,0,3,"Roswell, New Mexico","Two people were wounded inside the gymnasium of Berrendo Middle School, at about 8:10 a.m.. An 11-year-old boy and a 13-year-old girl were airlifted to a hospital in Lubbock, Texas in critical condition. The 12-year-old suspected shooter, Mason Campbell, a seventh grade student, was apprehended at the scene after he was talked down by a staff member and dropped the shotgun. A staff member received minor injuries. Campbell was charged with three counts of aggravated battery with a deadly weapon. He was sentenced to a maximum sentence of confinement in a juvenile detention facility until he is twenty one years old.[462]"
1/17/14,0,2,"Philadelphia, Pennsylvania","A student allegedly shot two other students in the gymnasium at Delaware Valley Charter School. Both victims, a male and a female, were shot in the arm. They were taken to a nearby hospital and are in stable condition, police say. Police Commissioner Charles Ramsey said at a news conference that the shooter ran out of the school after the shooting but was taken into custody near his home. 17-year-old Raisheem Rochwell was arrested and charged as an adult for aggravated assault, recklessly endangering another person and firearms offenses. Rochwell was sentenced to two years of juvenile detention.[463]"
1/20/14,0,1,"Chester, Pennsylvania",One person was critically injured at Widener University. The incident occurred around 10 p.m. outside the university sport’s complex and led to an 8-hour university lock-down. The suspect was not immediately found.[464]
1/21/14,1,0,"West Lafayette, Indiana","A 21-year-old student, Andrew Boldt, was killed in a classroom building on the campus of Purdue University. 24-year-old student Cody Cousins was found guilty of the murder and was sentenced to sixty-five years of prison. In October 2014, Cousins committed suicide in his cell.[465]"
1/24/14,1,0,"Orangeburg, South Carolina",A 20-year-old student was killed at South Carolina State University. A 19-year-old was arrested and charged with murder.[466]
1/25/14,1,0,"Los Angeles, California",A man was killed at Los Angeles Valley College. Two suspects were arrested in the fatal shooting.[467]
1/27/14,0,1,"Carbondale, Illinois",A group of students at Rebound High School got in an argument in the school's parking lot. One student pulled out a gun and shot another student in the ensuing altercation. An 18-year-old suspect is facing charges of attempted murder.[468]
1/28/14,0,1,"Nashville, Tennessee",One student was shot in the leg in an apparent altercation over a gambling debt at Tennessee State University.[469]
